{
  "module_id": "EG3.MOD.MODIFIER.POPGEN.v1",
  "module_name": "Susceptibility Modifier Module — Population Genomics",
  "module_class": "Modifier",
  "maturity_class": "C",
  "extends": [
    "SusceptibilityModifierModule"
  ],
  "scope": {
    "species": "human",
    "modifier_type": "germline_variant",
    "genes_covered": [
      "_description",
      "CYP1A2",
      "CYP2E1",
      "CYP3A4",
      "GSTM1",
      "GSTT1",
      "GSTP1",
      "NQO1",
      "NAT2"
    ],
    "phenotype_classes": [
      "PM",
      "IM",
      "NM",
      "RM",
      "UM",
      "null"
    ],
    "special_cases": [
      "ALDH2_star1_star2",
      "GSTM1_null",
      "GSTT1_null"
    ]
  },
  "input_ports": [
    {
      "name": "gene",
      "type": "string",
      "description": "Enzyme gene symbol"
    },
    {
      "name": "genotype",
      "type": "string",
      "description": "Allele diplotype or phenotype class (PM/IM/NM/RM/UM/null)"
    }
  ],
  "output_ports": [
    {
      "name": "activity_multiplier",
      "type": "float",
      "description": "Scaling factor for Vmax: NM=1.0, IM=0.5, PM=0.0, UM=2.0, RM=1.5"
    }
  ],
  "internal_state": [],
  "causal_role_map": {
    "genotype": "moderator",
    "activity_multiplier": "effect_on_enzyme_flux"
  },
  "graph_nodes": [
    "AHR",
    "CYP1A2",
    "ADH1B",
    "GSTM1",
    "AS3MT",
    "MT2A",
    "MT1A",
    "ALDH2",
    "ADH1C",
    "CYP3A4",
    "GSTO2",
    "GSTP1",
    "GSTO1",
    "NAT2",
    "CYP2E1",
    "SLC11A1",
    "ARNT",
    "HLA_DPB1",
    "GSTT1",
    "PARP1",
    "NQO1"
  ],
  "graph_edges": [],
  "causal_edges": [],
  "mechanism_type": "genotype_activity_scaling",
  "equation_type": "lookup multiplier",
  "update_rule": "effective_Vmax = Vmax × activity_multiplier[gene][genotype]",
  "parameters": [
    {
      "gene": "CYP1A2",
      "phenotype": "UM",
      "activity_multiplier": 1.8,
      "frequency": 0.1,
      "alleles": "*1F/*1F or inducible phenotype",
      "source": "interaction_parameters.json#genotype_modifiers"
    },
    {
      "gene": "CYP1A2",
      "phenotype": "NM",
      "activity_multiplier": 1.0,
      "frequency": 0.55,
      "alleles": "*1A reference",
      "source": "interaction_parameters.json#genotype_modifiers"
    },
    {
      "gene": "CYP1A2",
      "phenotype": "IM",
      "activity_multiplier": 0.5,
      "frequency": 0.25,
      "alleles": "*1C, *1D",
      "source": "interaction_parameters.json#genotype_modifiers"
    },
    {
      "gene": "CYP1A2",
      "phenotype": "PM",
      "activity_multiplier": 0.1,
      "frequency": 0.05,
      "alleles": "rare null alleles",
      "source": "interaction_parameters.json#genotype_modifiers"
    },
    {
      "gene": "CYP2E1",
      "phenotype": "NM",
      "activity_multiplier": 1.0,
      "frequency": 0.8,
      "alleles": "*1A",
      "source": "interaction_parameters.json#genotype_modifiers"
    },
    {
      "gene": "CYP2E1",
      "phenotype": "UM_c1c1",
      "activity_multiplier": 1.4,
      "frequency": 0.12,
      "alleles": "*1C/*1C — higher inducibility",
      "source": "interaction_parameters.json#genotype_modifiers"
    },
    {
      "gene": "CYP2E1",
      "phenotype": "IM",
      "activity_multiplier": 0.7,
      "frequency": 0.08,
      "alleles": "reduced expression variants",
      "source": "interaction_parameters.json#genotype_modifiers"
    },
    {
      "gene": "CYP3A4",
      "phenotype": "NM",
      "activity_multiplier": 1.0,
      "frequency": 0.75,
      "alleles": "",
      "source": "interaction_parameters.json#genotype_modifiers"
    },
    {
      "gene": "CYP3A4",
      "phenotype": "IM",
      "activity_multiplier": 0.5,
      "frequency": 0.2,
      "alleles": "*22 loss-of-function",
      "source": "interaction_parameters.json#genotype_modifiers"
    },
    {
      "gene": "CYP3A4",
      "phenotype": "UM",
      "activity_multiplier": 1.5,
      "frequency": 0.05,
      "alleles": "CYP3A4*1G amplification",
      "source": "interaction_parameters.json#genotype_modifiers"
    },
    {
      "gene": "GSTM1",
      "phenotype": "active",
      "activity_multiplier": 1.0,
      "frequency": 0.5,
      "alleles": "GSTM1 present — PAH-GSH conjugation functional",
      "source": "interaction_parameters.json#genotype_modifiers"
    },
    {
      "gene": "GSTM1",
      "phenotype": "null",
      "activity_multiplier": 0.0,
      "frequency": 0.5,
      "alleles": "GSTM1 deletion — NO GSH conjugation of PAH epoxides. Major cancer risk factor.",
      "source": "interaction_parameters.json#genotype_modifiers"
    },
    {
      "gene": "GSTT1",
      "phenotype": "active",
      "activity_multiplier": 1.0,
      "frequency": 0.8,
      "alleles": "",
      "source": "interaction_parameters.json#genotype_modifiers"
    },
    {
      "gene": "GSTT1",
      "phenotype": "null",
      "activity_multiplier": 0.0,
      "frequency": 0.2,
      "alleles": "GSTT1 deletion — impaired detox of small electrophiles including ethylene oxide",
      "source": "interaction_parameters.json#genotype_modifiers"
    },
    {
      "gene": "GSTP1",
      "phenotype": "Ile105Ile",
      "activity_multiplier": 1.0,
      "frequency": 0.45,
      "alleles": "High activity toward BPDE",
      "source": "interaction_parameters.json#genotype_modifiers"
    },
    {
      "gene": "GSTP1",
      "phenotype": "Ile105Val",
      "activity_multiplier": 0.6,
      "frequency": 0.4,
      "alleles": "Moderate reduction",
      "source": "interaction_parameters.json#genotype_modifiers"
    },
    {
      "gene": "GSTP1",
      "phenotype": "Val105Val",
      "activity_multiplier": 0.3,
      "frequency": 0.15,
      "alleles": "Significant activity reduction",
      "source": "interaction_parameters.json#genotype_modifiers"
    },
    {
      "gene": "NQO1",
      "phenotype": "WT",
      "activity_multiplier": 1.0,
      "frequency": 0.75,
      "alleles": "Detoxifies quinones",
      "source": "interaction_parameters.json#genotype_modifiers"
    },
    {
      "gene": "NQO1",
      "phenotype": "heterozygous_609CT",
      "activity_multiplier": 0.5,
      "frequency": 0.2,
      "alleles": "",
      "source": "interaction_parameters.json#genotype_modifiers"
    },
    {
      "gene": "NQO1",
      "phenotype": "homozygous_609TT",
      "activity_multiplier": 0.02,
      "frequency": 0.04,
      "alleles": "Near-null NQO1; benzene risk greatly increased",
      "source": "interaction_parameters.json#genotype_modifiers"
    },
    {
      "gene": "NAT2",
      "phenotype": "rapid",
      "activity_multiplier": 2.0,
      "frequency": 0.25,
      "alleles": "Fast N-acetyltransferase — HCA detox vs activation balance",
      "source": "interaction_parameters.json#genotype_modifiers"
    },
    {
      "gene": "NAT2",
      "phenotype": "intermediate",
      "activity_multiplier": 1.0,
      "frequency": 0.45,
      "alleles": "",
      "source": "interaction_parameters.json#genotype_modifiers"
    },
    {
      "gene": "NAT2",
      "phenotype": "slow",
      "activity_multiplier": 0.3,
      "frequency": 0.3,
      "alleles": "Slow N-acetyltransferase — reduced HCA detoxification in colon; increased bladder risk",
      "source": "interaction_parameters.json#genotype_modifiers"
    },
    {
      "gene_case": "ALDH2_star1_star2",
      "phenotype": "heterozygote",
      "activity_fraction": 0.25,
      "mechanism": "dominant_negative",
      "note": "ALDH2*2 is dominant-negative; heterozygote retains only ~25% of *1/*1 activity",
      "source": "PMC3525274"
    },
    {
      "gene_case": "GSTM1_null",
      "phenotype": "null/null",
      "activity_fraction": 0.0,
      "mechanism": "gene_deletion",
      "note": "GSTM1-null is a complete gene deletion polymorphism (~50% population frequency)",
      "source": "GSTM1 null polymorphism literature"
    },
    {
      "gene_case": "GSTT1_null",
      "phenotype": "null/null",
      "activity_fraction": 0.0,
      "mechanism": "gene_deletion",
      "note": "GSTT1-null is a complete gene deletion polymorphism (~20% population frequency)",
      "source": "GSTT1 null polymorphism literature"
    },
    {
      "name": "standard_scale_PM_IM_NM_RM_UM",
      "PM": 0.0,
      "IM": 0.5,
      "NM": 1.0,
      "RM": 1.5,
      "UM": 2.0,
      "null": 0.0,
      "source": "kinetic_parameters.json#genotype_modifiers#standard_scale"
    }
  ],
  "evidence_bundle": [
    {
      "ref": "PharmGKB VIP summaries / ClinPGx gene dossiers",
      "note": "Allele function and clinical interpretation for NAT1/NAT2, GSTM1/GSTT1/GSTP1, ALDH2, UGT1A1, CYP2C9, CYP2C19, CYP2D6"
    },
    {
      "ref": "PMC3525274",
      "note": "ALDH2*2 dominant-negative; heterozygote ~25% wildtype CLint"
    },
    {
      "ref": "GSTM1 null polymorphism literature",
      "note": "GSTM1 gene deletion ~50% frequency; complete loss of BPDE conjugation"
    },
    {
      "ref": "GSTT1 null polymorphism literature",
      "note": "GSTT1 gene deletion ~20% frequency"
    },
    {
      "ref": "interaction_parameters.json#genotype_modifiers",
      "note": "Full per-gene phenotype table with frequencies and alleles"
    }
  ],
  "uncertainty": {
    "confidence": "moderate_to_high",
    "notes": "Standard phenotype scale (PM=0, IM=0.5, NM=1.0, RM=1.5, UM=2.0) is a heuristic approximation; real activity is continuous. Frequency data is population-averaged.",
    "context_sensitivity": "allele frequencies differ by ancestry; not ancestry-stratified in current data"
  },
  "validation_status": "curated",
  "cedt_mapping": {
    "activity_multiplier": "host_variable → EnzymeActivityModifier",
    "twin_layer": "host"
  },
  "promotion_status": "causal",
  "version": "1.0.0"
}