{
  "module_id": "EG3.MOD.MECHANISM.OXSTRESS.v1",
  "module_name": "Oxidative Stress Mechanism Module",
  "module_class": "Mechanism",
  "maturity_class": "C",
  "extends": [
    "MechanismModule"
  ],
  "scope": {
    "species": "human",
    "mechanism": "reactive_oxygen_species_pathway_perturbation",
    "primary_agents": [
      "Cd",
      "Ni",
      "CrVI",
      "As",
      "Benzene",
      "Ethanol",
      "MMA_III"
    ],
    "affected_pathways": [
      "8-OHdG formation",
      "PARP activation",
      "NER impairment",
      "GSH depletion"
    ]
  },
  "input_ports": [
    {
      "name": "ROS_burden_score",
      "type": "float",
      "description": "Upstream ROS burden from biotransformation module"
    },
    {
      "name": "metal_exposure",
      "type": "dict",
      "description": "Metal class concentration inputs"
    },
    {
      "name": "GSH_pool_fraction",
      "type": "float",
      "description": "Current GSH pool fraction from interaction module"
    }
  ],
  "output_ports": [
    {
      "name": "ROS_burden",
      "type": "float",
      "description": "Aggregate ROS score from all pathway-activating agents"
    },
    {
      "name": "oxidative_adduct_score",
      "type": "float",
      "description": "Score for 8-OHdG, Oxo_dG-type adducts predicted from ROS level"
    },
    {
      "name": "repair_capacity_index",
      "type": "float",
      "description": "0-1 index representing DNA repair enzyme availability"
    }
  ],
  "internal_state": [],
  "causal_role_map": {
    "ROS_generator": "treatment",
    "GSH_pool": "mediator_protective",
    "OGG1_XRCC1_ERCC2": "repair_mediators",
    "8_OHdG": "outcome_marker"
  },
  "graph_nodes": [
    "hsa00980",
    "hsa05208",
    "KEGG980G",
    "dioxin_pathway",
    "metal_carcinogenesis",
    "hsa05204",
    "aldehyde_pathway",
    "hsa00982",
    "nitrosamine_pathway",
    "chlorinated_pathway",
    "alkylating_pathway",
    "hsa00140"
  ],
  "graph_edges": [
    "XPC->AFB1_Gua:REPAIRS",
    "XRCC1->N7_methyl_dG:REPAIRS",
    "XRCC1->Cr_dG:REPAIRS",
    "XRCC1->M1_dG:REPAIRS",
    "XRCC1->8_OHdG:REPAIRS",
    "XPC->Cr_DNA_ternary:REPAIRS",
    "XPC->Ni_DPC:REPAIRS",
    "MGMT->Ni:REPAIRS",
    "XRCC1->BQ_dG:REPAIRS",
    "XRCC1->etheno_dA:REPAIRS",
    "OGG1->Oxo_dG:REPAIRS",
    "XPC->DMBA_dA:REPAIRS",
    "XRCC1->Acr_dG:REPAIRS",
    "XRCC1->N7_GA_dG:REPAIRS",
    "XRCC1->ABP_dG:REPAIRS",
    "XPC->BPDE_dG:REPAIRS",
    "OGG1->8_OHdG:REPAIRS",
    "ERCC2->Ni_DPC:REPAIRS",
    "PARP1->8_OHdG:REPAIRS",
    "ERCC2->DMBA_dA:REPAIRS",
    "FANCD2->N2_ethylidene_dG:REPAIRS",
    "ERCC2->BPDE_dG:REPAIRS",
    "ERCC2->Cr_DNA_binary:REPAIRS",
    "MGMT->O6_methyl_dG:REPAIRS",
    "XRCC1->PhIP_dG:REPAIRS"
  ],
  "causal_edges": [],
  "mechanism_type": "oxidative_stress",
  "equation_type": "rule-based",
  "update_rule": "ROS_burden = Σ(metal_exposure[m] × indirect_genotoxicity_score[m]) + GSH_depleted_fraction × ROS_amplification_factor;  oxidative_adduct_score = ROS_burden × repair_susceptibility;  repair_capacity_index = min(1.0, OGG1_activity + XRCC1_activity + ERCC2_activity) — reduced by GSH depletion and metal inhibition;  PARP1 activated when SSB_rate > threshold",
  "parameters": [
    {
      "name": "Cd_ROS_generation",
      "mechanism": "indirect_genotoxicity",
      "notes": "Cd inhibits NER; displaces Zn in repair enzymes; indirect ROS via MT depletion at high doses",
      "source": "kinetic_parameters.json#HeavyMetal; IARC Monographs"
    },
    {
      "name": "CrVI_ROS_generation",
      "mechanism": "Fenton-like; Cr(VI)→Cr(V)→Cr(III) reduction cycle generates ROS",
      "notes": "3 GSH consumed per Cr(VI); generates •OH via Fenton-like reaction",
      "source": "interaction_parameters.json#gsh_depletion"
    },
    {
      "name": "Ni_ROS_generation",
      "mechanism": "Ni²⁺ displaces Fe²⁺ in Fenton reaction; also inhibits PARP",
      "source": "kinetic_parameters.json#HeavyMetal"
    },
    {
      "name": "MMA_III_ROS_generation",
      "mechanism": "Trivalent monomethyl arsenic generates ROS more efficiently than inorganic arsenate",
      "source": "kinetic_parameters.json#HeavyMetal"
    },
    {
      "name": "OGG1_repair_capacity",
      "enzyme": "OGG1",
      "substrate": "8-OHdG / Oxo_dG",
      "mechanism": "BER; removes 8-oxoguanine",
      "source": "registry_graph edges OGG1->8_OHdG:REPAIRS, OGG1->Oxo_dG:REPAIRS"
    },
    {
      "name": "XRCC1_BER_coordination",
      "enzyme": "XRCC1",
      "substrates": [
        "N7_methyl_dG",
        "Cr_dG",
        "M1_dG",
        "8_OHdG",
        "BQ_dG",
        "etheno_dA",
        "Acr_dG",
        "N7_GA_dG",
        "ABP_dG",
        "PhIP_dG"
      ],
      "mechanism": "BER scaffold; coordinates PARP1, DNA polymerase β, LIG3",
      "source": "registry_graph XRCC1->*:REPAIRS edges"
    },
    {
      "name": "ERCC2_NER_capacity",
      "enzyme": "ERCC2",
      "substrates": [
        "Ni_DPC",
        "DMBA_dA",
        "BPDE_dG",
        "Cr_DNA_binary"
      ],
      "mechanism": "NER helicase subunit of TFIIH",
      "source": "registry_graph ERCC2->*:REPAIRS edges"
    }
  ],
  "evidence_bundle": [
    {
      "ref": "IARC Monographs Vol. 100C (metals)",
      "note": "CrVI, Cd, Ni oxidative stress mechanisms"
    },
    {
      "ref": "SBS18 — Viel 2017 Clin Cancer Res",
      "note": "ROS-associated mutational signature"
    },
    {
      "ref": "kinetic_parameters.json#HeavyMetal",
      "note": "Indirect genotoxicity model for heavy metals"
    },
    {
      "ref": "Registry graph REPAIRS edges (n=25)",
      "note": "DNA repair enzyme to adduct mapping"
    },
    {
      "ref": "interaction_parameters.json#gsh_depletion",
      "note": "GSH depletion — Cr(VI) 3:1 stoichiometry; PMC9412641"
    }
  ],
  "uncertainty": {
    "confidence": "moderate",
    "notes": "Quantitative ROS burden parameters absent from JSON sources; qualitative basis used. equation_type=rule-based appropriate. Metal indirect genotoxicity is modeled as score-based approximation.",
    "context_sensitivity": "ROS burden is strongly tissue and dose dependent; non-linear GSH depletion dynamics"
  },
  "validation_status": "literature-only",
  "cedt_mapping": {
    "ROS_burden": "state_quality → oxidative_stress_level",
    "oxidative_adduct_score": "outcome → adduct_burden",
    "twin_layer": "state_quality"
  },
  "promotion_status": "causal",
  "version": "1.0.0"
}